<?xml version="1.0" encoding="UTF-8"?>

<Data xmlns:xs="http://www.w3.org/2001/XMLSchema-instance"
      xs:noNamespaceSchemaLocation="../src/lib/simulator/io/xml_reader/SimulationInputSchema.xsd">

    <header base_name="Simulation of a falling drop - Wall" output_file_name="falling_drop_simulation"
            output_frequency="100" t_end="10" seed="1234"/>

    <linked_cells>
        <domain_size>
            <value>0</value>
            <value>180</value>
            <value>90</value>
        </domain_size>
    </linked_cells>

    <lennard_jones>
        <settings delta_t="0.00005" sigma="1" epsilon="5" mass_m="1" distance_h="1.1225" brown_motion="0.1" cutoff_radius="0"/>
        <discs>
            <Disc>
                <coordinate>
                    <value>60</value>
                    <value>25</value>
                    <value>0</value>
                </coordinate>
                <velocity>
                    <value>0</value>
                    <value>-10</value>
                    <value>0</value>
                </velocity>
                <radius>15</radius>
            </Disc>
        </discs>
    </lennard_jones>
</Data>